{
  "schemaVersion": 1,
  "manifestId": "sha256:a6ee29fd1592a47b6855b09506f9e824f02753524beb8a669b278960544c6d41",
  "runId": "run-golden",
  "workerId": "repo-scout",
  "catalogLockHash": "sha256:e77cff1b8f45a3cb1382f856261d4ea7af288a4b989b8b02dc7384fc6632cfb2",
  "backend": "orca-pi",
  "task": "Inspect the parser and report evidence.",
  "acceptanceCriteria": [
    "Relevant parser entry points are cited."
  ],
  "model": {
    "id": "gpt-5-mini",
    "provider": "openai-codex",
    "thinking": "low",
    "tier": "fast"
  },
  "permissionProfile": "observe",
  "workspace": {
    "mode": "shared-readonly",
    "repositoryId": "repo-fixture",
    "baseRevision": "0123456789abcdef"
  },
  "resources": {
    "skills": [],
    "extensions": [
      {
        "id": "extension.worker-submit",
        "sha256": "sha256:2141e5f7133731adba352c5e957027e87c485696c5fcecf8e4772bf4b8b5b4f7"
      }
    ],
    "promptTemplates": [
      {
        "id": "policy.evidence",
        "sha256": "sha256:135bdf201fa8b067fb1f8f349f6402dd56a24b2b8a8c5ac6c14f67e22d449406"
      }
    ],
    "systemFragments": [
      {
        "id": "role.repo-scout",
        "sha256": "sha256:d0652cacbecfb2681d9d5e2df6b279831e1cb448cfde495408e4597a30e20786"
      },
      {
        "id": "system.worker-protocol",
        "sha256": "sha256:b53d2c3be88339b83a0db2e1a5bf5bfa2c87942818cb72b10266bb881a9771ea"
      }
    ],
    "contextFiles": [
      {
        "path": "AGENTS.md",
        "sha256": "sha256:4fd1ed7a78eee6681002c9540def30f754a63f770837bdb6e540b090e0eda448"
      }
    ],
    "mcpServers": []
  },
  "tools": {
    "allow": [
      "read",
      "grep",
      "find",
      "ls",
      "submit_worker_result"
    ]
  },
  "prompt": {
    "orderedFragmentHashes": [
      "sha256:b53d2c3be88339b83a0db2e1a5bf5bfa2c87942818cb72b10266bb881a9771ea",
      "sha256:d0652cacbecfb2681d9d5e2df6b279831e1cb448cfde495408e4597a30e20786",
      "sha256:135bdf201fa8b067fb1f8f349f6402dd56a24b2b8a8c5ac6c14f67e22d449406"
    ]
  },
  "budget": {
    "timeoutSeconds": 600,
    "maxDelegationDepth": 0
  },
  "returnContract": "worker-result-v1"
}
